{
  "schema_version": "1.0",
  "analysis": {
    "tool": "github.com/uudashr/gocognit/cmd/gocognit",
    "version": "v1.2.1",
    "args": [
      "-json",
      "-over",
      "0",
      "-ignore",
      "_test\\.go"
    ],
    "roots": [
      "./internal",
      "./cmd"
    ]
  },
  "threshold": 80,
  "allowances": []
}
